{
  "schema_version": "1.0.0",
  "record_type": "agent_run",
  "id": "dq-bone-endpoint-synthesis-supervisor-review-2026-06-21",
  "agent_role": "supervisor_agent",
  "agent_id": "codex-supervisor-agent",
  "mode": "synthesis_refresh",
  "started_at": "2026-06-22T04:00:00Z",
  "completed_at": "2026-06-22T04:10:00Z",
  "status": "succeeded",
  "scope": {
    "question": "Review taxonomy mapping, synthesis boundaries, and safety limitations for the D+Q bone endpoint synthesis candidate.",
    "hallmark_ids": [
      "cellular_senescence",
      "stem_cell_exhaustion"
    ],
    "track_ids": [
      "senolytics"
    ],
    "intervention_ids": [
      "dasatinib-quercetin"
    ]
  },
  "canonical_write_policy": "candidate_change_required",
  "execution": {
    "surface": "codex_exec",
    "isolation": "git_worktree",
    "workspace_path": "/tmp/lhr-codex-worker-supervisor-review-clean-20260621",
    "prompt_file": "research/agent-runs/prompts/dq-bone-endpoint-synthesis-supervisor-review-2026-06-21.md",
    "job_file": "ops/codex-jobs/archive/dq-bone-endpoint-synthesis-supervisor-review-2026-06-21.json",
    "output_schema_path": "schemas/agent-run.codex-output.schema.json",
    "output_path": "research/agent-runs/dq-bone-endpoint-synthesis-supervisor-review-2026-06-21.json",
    "jsonl_log_path": "research/agent-runs/logs/dq-bone-endpoint-synthesis-supervisor-review-2026-06-21.jsonl",
    "sandbox": "workspace-write",
    "approval_policy": "never"
  },
  "inputs": [
    {
      "input_type": "user_request",
      "reference": "dq-bone-endpoint-synthesis-supervisor-review-2026-06-21",
      "summary": "Coordinator requested supervisor-agent review of taxonomy mapping, synthesis boundary, and safety limitations for the D+Q bone endpoint synthesis candidate."
    },
    {
      "input_type": "candidate_change",
      "reference": "senolytics-dq-bone-endpoint-synthesis-groups-2026-06-21",
      "summary": "Reviewed candidate lifecycle, required lanes, proposed synthesis-group ledger, and evidence-review linkage."
    },
    {
      "input_type": "record",
      "reference": "data/synthesis-groups/senolytics-dq-bone-*-synthesis-compatibility-2026-06-21.json",
      "summary": "Reviewed the six endpoint-specific synthesis groups proposed by the candidate: CTx, short-term P1NP, 20-week P1NP, BMD, SASP, and safety."
    },
    {
      "input_type": "other",
      "reference": "required-guidance-and-schemas",
      "summary": "Read the required runbooks, synthesis rules, agent-run schemas, candidate-change schema, evidence-review schema, and synthesis-group schema before writing review records."
    }
  ],
  "outputs": {
    "summary": "Completed three supervisor-agent review lanes for the D+Q bone endpoint synthesis candidate, set the candidate to in_review, linked the three evidence reviews, and regenerated latest exports. All three lanes are complete, accepting, non-blocking, and have no open major or critical findings.",
    "candidate_change_id": "senolytics-dq-bone-endpoint-synthesis-groups-2026-06-21",
    "proposed_records": [
      {
        "record_type": "candidate_change",
        "record_id": "senolytics-dq-bone-endpoint-synthesis-groups-2026-06-21",
        "path": "data/candidate-changes/senolytics-dq-bone-endpoint-synthesis-groups-2026-06-21.json",
        "change_type": "update",
        "rationale": "Moved the candidate to in_review and linked the three active supervisor-agent evidence review records."
      },
      {
        "record_type": "evidence_review",
        "record_id": "senolytics-dq-bone-endpoint-taxonomy-mapping-2026-06-21",
        "path": "data/evidence-reviews/senolytics-dq-bone-endpoint-taxonomy-mapping-2026-06-21.json",
        "change_type": "create",
        "rationale": "Records the completed taxonomy-mapping supervisor review for the endpoint synthesis candidate."
      },
      {
        "record_type": "evidence_review",
        "record_id": "senolytics-dq-bone-endpoint-synthesis-boundary-2026-06-21",
        "path": "data/evidence-reviews/senolytics-dq-bone-endpoint-synthesis-boundary-2026-06-21.json",
        "change_type": "create",
        "rationale": "Records the completed synthesis-boundary supervisor review for the endpoint synthesis candidate."
      },
      {
        "record_type": "evidence_review",
        "record_id": "senolytics-dq-bone-endpoint-safety-limitations-2026-06-21",
        "path": "data/evidence-reviews/senolytics-dq-bone-endpoint-safety-limitations-2026-06-21.json",
        "change_type": "create",
        "rationale": "Records the completed safety-limitations supervisor review for the endpoint synthesis candidate."
      }
    ],
    "generated_files": [
      "data/evidence-reviews/senolytics-dq-bone-endpoint-taxonomy-mapping-2026-06-21.json",
      "data/evidence-reviews/senolytics-dq-bone-endpoint-synthesis-boundary-2026-06-21.json",
      "data/evidence-reviews/senolytics-dq-bone-endpoint-safety-limitations-2026-06-21.json"
    ],
    "export_paths": [
      "exports/latest/audit-manifest.json",
      "exports/latest/coverage-status.json",
      "exports/latest/evidence-map.json"
    ]
  },
  "quality_checks": [
    {
      "check_name": "supervisor_review_lanes",
      "status": "passed",
      "summary": "Verified taxonomy_mapping, synthesis_boundary, and safety_limitations reviews are complete, accepting, non-blocking, and free of open major or critical findings."
    },
    {
      "check_name": "validate_records",
      "status": "passed",
      "summary": "npm run validate:records passed; 108 JSON files validated."
    },
    {
      "check_name": "audit_references",
      "status": "passed",
      "summary": "npm run audit:references passed; reference audit passed for 101 record files."
    },
    {
      "check_name": "export_latest",
      "status": "passed",
      "summary": "npm run export:latest passed; 11 export files were written to exports/latest."
    },
    {
      "check_name": "verify_knowledge_base",
      "status": "passed",
      "summary": "npm run verify:knowledge-base passed, including validation, reference audit, export audit, agent-schema audit, Codex job audit, and agentic-process audit."
    },
    {
      "check_name": "audit_exports",
      "status": "passed",
      "summary": "Ran within npm run verify:knowledge-base; export audit passed for 8 JSONL exports and 10 manifest hashes."
    },
    {
      "check_name": "audit_agent_schemas",
      "status": "passed",
      "summary": "Ran within npm run verify:knowledge-base; agent schema audit passed."
    },
    {
      "check_name": "audit_codex_jobs",
      "status": "passed",
      "summary": "Ran within npm run verify:knowledge-base; Codex job audit passed for 2 job files."
    },
    {
      "check_name": "audit_agentic_process",
      "status": "passed",
      "summary": "Ran within npm run verify:knowledge-base; agentic process audit passed for 184 files."
    },
    {
      "check_name": "post_export",
      "status": "passed",
      "summary": "post_export exited 0: > longevity-hallmarks-research@0.1.0 export:latest > node scripts/export-latest.mjs Wrote 11 export file(s) to exports/latest."
    },
    {
      "check_name": "post_verify",
      "status": "passed",
      "summary": "post_verify exited 0: > longevity-hallmarks-research@0.1.0 audit:agent-schemas > node scripts/audit-agent-schemas.mjs Agent schema audit passed. > longevity-hallmarks-research@0.1.0 audit:agentic-process > node scripts/audit-agentic-process.mjs Agentic process audit passed for 185 file(s)."
    },
    {
      "check_name": "post_job_audit",
      "status": "passed",
      "summary": "post_job_audit exited 0: > longevity-hallmarks-research@0.1.0 audit:codex-jobs > node scripts/audit-codex-jobs.mjs Codex job audit passed for 2 job file(s)."
    }
  ],
  "blocking_issues": [],
  "next_actions": [
    "Leave the candidate in_review for coordinator handling; no promotion was performed by this worker."
  ]
}
