{
  "schema_version": "1.0.0",
  "record_type": "agent_run",
  "id": "self-healing-candidate-review-coverage-gap-senolytics-exact-effect-extraction-followup-2-repair-taxonomy-mapping",
  "agent_role": "supervisor_agent",
  "agent_id": "codex-cli",
  "mode": "agent_directed",
  "started_at": "2026-06-28T18:29:39Z",
  "completed_at": "2026-06-28T18:33:14Z",
  "status": "succeeded",
  "scope": {
    "question": "candidate_review: Required review lane is missing: taxonomy_mapping.",
    "hallmark_ids": [
      "cellular_senescence"
    ],
    "track_ids": [
      "senolytics"
    ],
    "intervention_ids": []
  },
  "canonical_write_policy": "candidate_change_required",
  "execution": {
    "surface": "codex_exec",
    "isolation": "git_worktree",
    "workspace_path": "/tmp/lhr-codex-worktrees/self-healing-candidate-review-coverage-gap-senolytics-exact-effect-extraction-followup-2-repair-taxonomy-mapping-20260628T182939z",
    "prompt_file": "research/agent-runs/prompts/self-healing-candidate-review-coverage-gap-senolytics-exact-effect-extraction-followup-2-repair-taxonomy-mapping.md",
    "prompt_template_file": "docs/prompts/codex-agents/supervisor-review.md",
    "job_file": "ops/codex-jobs/archive/self-healing-candidate-review-coverage-gap-senolytics-exact-effect-extraction-followup-2-repair-taxonomy-mapping.json",
    "output_schema_path": "schemas/agent-run.codex-output.schema.json",
    "output_path": "research/agent-runs/self-healing-candidate-review-coverage-gap-senolytics-exact-effect-extraction-followup-2-repair-taxonomy-mapping.json",
    "jsonl_log_path": "research/agent-runs/logs/self-healing-candidate-review-coverage-gap-senolytics-exact-effect-extraction-followup-2-repair-taxonomy-mapping.jsonl",
    "sandbox": "workspace-write",
    "approval_policy": "never"
  },
  "inputs": [
    {
      "input_type": "other",
      "reference": "ops/supervisor-review-context-packs/self-healing-candidate-review-coverage-gap-senolytics-exact-effect-extraction-followup-2-repair-taxonomy-mapping.json",
      "summary": "Bounded supervisor review context pack for the taxonomy_mapping lane."
    },
    {
      "input_type": "candidate_change",
      "reference": "data/candidate-changes/coverage-gap-senolytics-exact-effect-extraction-followup-2-repair.json",
      "summary": "Target candidate change under taxonomy_mapping review."
    },
    {
      "input_type": "record",
      "reference": "data/coverage-assessments/senolytics-coverage-repair-2026-06-21.json",
      "summary": "Proposed coverage assessment reviewed for taxonomy category, track, hallmark, and gap-boundary mapping."
    },
    {
      "input_type": "record",
      "reference": "data/findings/dq-ipf-randomized-feasibility-tolerability-mixed.json",
      "summary": "Proposed IPF finding reviewed for hallmark, track, endpoint, evidence tier, and confidence mapping."
    },
    {
      "input_type": "record",
      "reference": "data/outcomes/dq-ipf-feasibility-tolerability.json",
      "summary": "Proposed IPF outcome reviewed for endpoint and analysis-role taxonomy mapping."
    },
    {
      "input_type": "record",
      "reference": "data/results/dq-ipf-tolerability-mixed.json",
      "summary": "Proposed IPF safety result reviewed for result type, adverse-event, direction, and evidence-tier taxonomy mapping."
    }
  ],
  "outputs": {
    "summary": "Created a repair candidate and complete taxonomy_mapping evidence review. The reviewed lane is accepted, non-blocking, and has no open major or critical findings.",
    "candidate_change_id": "candidate-review-coverage-gap-senolytics-exact-effect-extraction-followup-2-repair-taxonomy-mapping-repair",
    "proposed_records": [
      {
        "record_type": "candidate_change",
        "record_id": "candidate-review-coverage-gap-senolytics-exact-effect-extraction-followup-2-repair-taxonomy-mapping-repair",
        "path": "data/candidate-changes/candidate-review-coverage-gap-senolytics-exact-effect-extraction-followup-2-repair-taxonomy-mapping-repair.json",
        "change_type": "create",
        "rationale": "Tracks the bounded repair candidate ledger for the missing taxonomy_mapping review lane."
      },
      {
        "record_type": "evidence_review",
        "record_id": "coverage-gap-senolytics-exact-effect-extraction-followup-2-repair-taxonomy-mapping",
        "path": "data/evidence-reviews/coverage-gap-senolytics-exact-effect-extraction-followup-2-repair-taxonomy-mapping.json",
        "change_type": "create",
        "rationale": "Adds a complete non-blocking taxonomy_mapping supervisor review for the target candidate."
      }
    ],
    "generated_files": [
      "data/candidate-changes/candidate-review-coverage-gap-senolytics-exact-effect-extraction-followup-2-repair-taxonomy-mapping-repair.json",
      "data/evidence-reviews/coverage-gap-senolytics-exact-effect-extraction-followup-2-repair-taxonomy-mapping.json"
    ],
    "export_paths": []
  },
  "quality_checks": [
    {
      "check_name": "supervisor_review_lanes",
      "status": "passed",
      "summary": "Reviewed the required taxonomy_mapping lane and created a complete accept evidence_review with blocking=false and no open major or critical findings."
    },
    {
      "check_name": "candidate_agent_run_ledger_match",
      "status": "passed",
      "summary": "Final outputs.proposed_records exactly match the repair candidate proposed_records ledger."
    },
    {
      "check_name": "validate_records",
      "status": "passed",
      "summary": "npm run validate:records validated 507 JSON files."
    },
    {
      "check_name": "audit_references",
      "status": "passed",
      "summary": "npm run audit:references passed for 328 record files."
    },
    {
      "check_name": "audit_agent_schemas",
      "status": "passed",
      "summary": "npm run audit:agent-schemas passed."
    },
    {
      "check_name": "audit_agentic_process",
      "status": "passed",
      "summary": "npm run audit:agentic-process passed for 540 files."
    },
    {
      "check_name": "verify_knowledge_base",
      "status": "failed",
      "summary": "npm run verify:knowledge-base stopped at audit:exports because exports/latest/audit-manifest.json record_counts are stale; this is deferred to the coordinator post-run export:latest and verification phase."
    },
    {
      "check_name": "worker_output_contract",
      "status": "passed",
      "summary": "Worker emitted exactly one final JSON agent_run message, matched output_path, and avoided ad hoc schema-validation snippets."
    },
    {
      "check_name": "post_triage_state_export",
      "status": "passed",
      "summary": "post_triage_state_export exited 0: > longevity-hallmarks-research@0.1.0 export:triage-state > node scripts/export-triage-state.mjs Wrote ops/triage-state.v1.json."
    },
    {
      "check_name": "post_release_readiness_export",
      "status": "passed",
      "summary": "post_release_readiness_export exited 0: > longevity-hallmarks-research@0.1.0 export:release-readiness > node scripts/export-release-readiness.mjs Wrote ops/release-readiness.v1.json."
    },
    {
      "check_name": "post_reconciliation_export",
      "status": "passed",
      "summary": "post_reconciliation_export exited 0: > longevity-hallmarks-research@0.1.0 reconcile:parallel > node scripts/reconcile-parallel-outputs.mjs Wrote ops/reconciliation/parallel-reconciliation.v1.json."
    },
    {
      "check_name": "post_orchestration_metrics_export",
      "status": "passed",
      "summary": "post_orchestration_metrics_export exited 0: > longevity-hallmarks-research@0.1.0 metrics:orchestration > node scripts/export-orchestration-metrics.mjs Wrote ops/codex-batches/orchestration-metrics.v1.json."
    },
    {
      "check_name": "post_export",
      "status": "passed",
      "summary": "post_export exited 0: > longevity-hallmarks-research@0.1.0 export:latest > node scripts/export-latest.mjs Wrote 16 export file(s) to exports/latest."
    },
    {
      "check_name": "post_verify",
      "status": "passed",
      "summary": "post_verify exited 0: > longevity-hallmarks-research@0.1.0 audit:orchestration-smoke-contract > node scripts/audit-orchestration-smoke-contract.mjs Orchestration smoke contract audit passed for orchestration-smoke-budgeted-codex-worktree-2026-06-23. > longevity-hallmarks-research@0.1.0 audit:agentic-process > node scripts/audit-agentic-process.mjs Agentic process audit passed for 541 file(s)."
    }
  ],
  "blocking_issues": [],
  "next_actions": [
    "Coordinator post-run should run the configured export and knowledge-base verification steps to refresh stale exports/latest counts."
  ]
}
