{
  "schema_version": "1.0.0",
  "record_type": "agent_run",
  "id": "self-healing-candidate-review-coverage-gap-senolytics-exact-effect-extraction-followup-3-repair-synthesis-boundary",
  "agent_role": "supervisor_agent",
  "agent_id": "codex-cli-worker",
  "mode": "agent_directed",
  "started_at": "2026-06-29T21:19:53Z",
  "completed_at": "2026-06-29T21:21:36Z",
  "status": "succeeded",
  "scope": {
    "question": "candidate_review: Required review lane is missing: synthesis_boundary.",
    "hallmark_ids": [
      "cellular_senescence"
    ],
    "track_ids": [
      "senolytics"
    ],
    "intervention_ids": []
  },
  "canonical_write_policy": "candidate_change_required",
  "execution": {
    "surface": "codex_exec",
    "isolation": "git_worktree",
    "workspace_path": "/tmp/lhr-codex-worktrees/self-healing-candidate-review-coverage-gap-senolytics-exact-effect-extraction-followup-3-repair-synthesis-boundary-20260629T211854z",
    "prompt_file": "research/agent-runs/prompts/self-healing-candidate-review-coverage-gap-senolytics-exact-effect-extraction-followup-3-repair-synthesis-boundary.md",
    "prompt_template_file": "docs/prompts/codex-agents/supervisor-review.md",
    "job_file": "ops/codex-jobs/archive/self-healing-candidate-review-coverage-gap-senolytics-exact-effect-extraction-followup-3-repair-synthesis-boundary.json",
    "output_schema_path": "schemas/agent-run.codex-output.schema.json",
    "output_path": "research/agent-runs/self-healing-candidate-review-coverage-gap-senolytics-exact-effect-extraction-followup-3-repair-synthesis-boundary.json",
    "jsonl_log_path": "research/agent-runs/logs/self-healing-candidate-review-coverage-gap-senolytics-exact-effect-extraction-followup-3-repair-synthesis-boundary.jsonl",
    "sandbox": "workspace-write",
    "approval_policy": "never"
  },
  "inputs": [
    {
      "input_type": "other",
      "reference": "ops/supervisor-review-context-packs/self-healing-candidate-review-coverage-gap-senolytics-exact-effect-extraction-followup-3-repair-synthesis-boundary.json",
      "summary": "Bounded supervisor review context pack for the missing synthesis_boundary lane."
    },
    {
      "input_type": "candidate_change",
      "reference": "data/candidate-changes/coverage-gap-senolytics-exact-effect-extraction-followup-3-repair.json",
      "summary": "Target submitted candidate proposing a senolytics coverage-assessment repair."
    },
    {
      "input_type": "record",
      "reference": "data/coverage-assessments/senolytics-coverage-repair-2026-06-21.json",
      "summary": "Proposed coverage assessment update reviewed for synthesis-boundary discipline."
    }
  ],
  "outputs": {
    "summary": "Created the missing synthesis_boundary supervisor evidence_review with verdict accept and a repair candidate ledger containing the repair candidate plus evidence_review record. The review found the proposed coverage assessment stays within coverage and extraction-debt boundaries, does not create synthesis groups or pooled effects, and keeps cross-human safety synthesis blocked pending source and harmonization work.",
    "candidate_change_id": "candidate-review-coverage-gap-senolytics-exact-effect-extraction-followup-3-repair-synthesis-boundary-repair",
    "proposed_records": [
      {
        "record_type": "candidate_change",
        "record_id": "candidate-review-coverage-gap-senolytics-exact-effect-extraction-followup-3-repair-synthesis-boundary-repair",
        "path": "data/candidate-changes/candidate-review-coverage-gap-senolytics-exact-effect-extraction-followup-3-repair-synthesis-boundary-repair.json",
        "change_type": "create",
        "rationale": "Tracks this bounded repair candidate and its required synthesis_boundary review lane."
      },
      {
        "record_type": "evidence_review",
        "record_id": "coverage-gap-senolytics-exact-effect-extraction-followup-3-repair-synthesis-boundary",
        "path": "data/evidence-reviews/coverage-gap-senolytics-exact-effect-extraction-followup-3-repair-synthesis-boundary.json",
        "change_type": "create",
        "rationale": "Records the supervisor synthesis_boundary verdict for the target senolytics extraction follow-up repair candidate."
      }
    ],
    "generated_files": [
      "data/candidate-changes/candidate-review-coverage-gap-senolytics-exact-effect-extraction-followup-3-repair-synthesis-boundary-repair.json",
      "data/evidence-reviews/coverage-gap-senolytics-exact-effect-extraction-followup-3-repair-synthesis-boundary.json"
    ],
    "export_paths": []
  },
  "quality_checks": [
    {
      "check_name": "supervisor_review_lanes",
      "status": "passed",
      "summary": "Reviewed the required synthesis_boundary lane, completed a non-blocking accept review, and found no open major or critical findings."
    },
    {
      "check_name": "candidate_agent_run_ledger_match",
      "status": "passed",
      "summary": "Final outputs.proposed_records matches the repair candidate proposed_records ledger exactly."
    },
    {
      "check_name": "validate_records",
      "status": "passed",
      "summary": "npm run validate:records passed: 576 JSON files validated."
    },
    {
      "check_name": "audit_references",
      "status": "passed",
      "summary": "npm run audit:references passed for 374 record files."
    },
    {
      "check_name": "audit_agent_schemas",
      "status": "passed",
      "summary": "npm run audit:agent-schemas passed."
    },
    {
      "check_name": "audit_agentic_process",
      "status": "passed",
      "summary": "npm run audit:agentic-process passed for 602 files."
    },
    {
      "check_name": "verify_knowledge_base",
      "status": "failed",
      "summary": "npm run verify:knowledge-base stopped at audit:exports because exports/latest/audit-manifest.json record_counts are stale; coordinator post-run export and verification are expected."
    },
    {
      "check_name": "worker_output_contract",
      "status": "passed",
      "summary": "Worker emitted exactly one final JSON agent_run message, matched output_path, and avoided ad hoc schema-validation snippets."
    },
    {
      "check_name": "post_triage_state_export",
      "status": "passed",
      "summary": "post_triage_state_export exited 0: > longevity-hallmarks-research@0.1.0 export:triage-state > node scripts/export-triage-state.mjs Wrote ops/triage-state.v1.json."
    },
    {
      "check_name": "post_release_readiness_export",
      "status": "passed",
      "summary": "post_release_readiness_export exited 0: > longevity-hallmarks-research@0.1.0 export:release-readiness > node scripts/export-release-readiness.mjs Wrote ops/release-readiness.v1.json."
    },
    {
      "check_name": "post_reconciliation_export",
      "status": "passed",
      "summary": "post_reconciliation_export exited 0: > longevity-hallmarks-research@0.1.0 reconcile:parallel > node scripts/reconcile-parallel-outputs.mjs Wrote ops/reconciliation/parallel-reconciliation.v1.json."
    },
    {
      "check_name": "post_orchestration_metrics_export",
      "status": "passed",
      "summary": "post_orchestration_metrics_export exited 0: > longevity-hallmarks-research@0.1.0 metrics:orchestration > node scripts/export-orchestration-metrics.mjs Wrote ops/codex-batches/orchestration-metrics.v1.json."
    },
    {
      "check_name": "post_export",
      "status": "passed",
      "summary": "post_export exited 0: > longevity-hallmarks-research@0.1.0 export:latest > node scripts/export-latest.mjs Wrote 16 export file(s) to exports/latest."
    },
    {
      "check_name": "post_read_model_export",
      "status": "passed",
      "summary": "post_read_model_export exited 0: > longevity-hallmarks-research@0.1.0 export:read-model > node scripts/export-read-model.mjs Wrote exports/latest/read-model.sqlite."
    },
    {
      "check_name": "post_verify",
      "status": "passed",
      "summary": "post_verify exited 0: > longevity-hallmarks-research@0.1.0 audit:orchestration-smoke-contract > node scripts/audit-orchestration-smoke-contract.mjs Orchestration smoke contract audit passed for orchestration-smoke-budgeted-codex-worktree-2026-06-23. > longevity-hallmarks-research@0.1.0 audit:agentic-process > node scripts/audit-agentic-process.mjs Agentic process audit passed for 603 file(s)."
    }
  ],
  "blocking_issues": [],
  "next_actions": [
    "Coordinator post-run should regenerate exports and rerun verify:knowledge-base after this candidate/review record addition."
  ]
}
